HerbariumID,Bild,DB,Family,FullNameCache,Anmerkungen,Sammlerteam,Sammelnummer,CollectionDateBegin,CollectionDateEnd,Country,Locality,TitelEtikett,Expeditionsangabe,ShowOnMap,Latitude,Longitude,FundortUNdOeko,NameCache,Genus,Identifier,Barcode,StableURI
B100059258,https://iiif.jacq.org/b/?manifest=https://herbarium.bgbm.org/object/B100059258/manifest.json,JACQ,CYPERACEAE,Carex flacca Schreb.,MTB: 8331/2,"Willing,R. & Willing,E.",15127 D,2001-08-03,,Germany,"Bayern, NW Unternogg",,,https://www.openstreetmap.org/?mlat=47.6583&mlon=10.9739#map=15/47.6583/10.9739,47.658329010009766,10.97389030456543,,Carex flacca,Carex,J. Koopman 2023-11-25,B 10 0059258,https://herbarium.bgbm.org/object/B100059258
JACQID1073806,,JACQ,HYPERICACEAE,Hypericum perforatum L.,MTB: 8333/1,"Willing,R. & Willing,E.",14516 D,2001-07-30,,Germany,"Bayern, S Riegsee",,,https://www.openstreetmap.org/?mlat=47.6872&mlon=11.2317#map=15/47.6872/11.2317,47.68722152709961,11.231670379638672,,Hypericum perforatum,Hypericum,E.Willing,JACQ-ID 1073806,https://herbarium.bgbm.org/object/JACQID1073806
B100768173,https://iiif.jacq.org/b/?manifest=https://herbarium.bgbm.org/object/B100768173/manifest.json,JACQ,POTAMOGETONACEAE,Potamogeton alpinus Balb.,Herbar A.Ludwig,"Hupke,H.",s.n.,1952-07-28,,Germany,"Oberhessen, Kr. Alsfeld, Gr. Felda; im Dautzenroder Teich",,,https://www.openstreetmap.org/?mlat=50.6692&mlon=9.17639#map=15/50.6692/9.17639,50.66917037963867,9.176389694213867,,Potamogeton alpinus,Potamogeton,Hupke,B 10 0768173,https://herbarium.bgbm.org/object/B100768173
JACQID1067283,,JACQ,CHENOPODIACEAE,Chenopodium album L.,MTB: 3641/2,"Willing,R. & Willing,E.",11240 D,1999-09-08,,Germany,"Brandenburg, S Schmerzke",,,https://www.openstreetmap.org/?mlat=52.38&mlon=12.5933#map=15/52.38/12.5933,52.380001068115234,12.59333038330078,,Chenopodium album,Chenopodium,E.Willing,JACQ-ID 1067283,https://herbarium.bgbm.org/object/JACQID1067283
B101302568,https://iiif.jacq.org/b/?manifest=https://herbarium.bgbm.org/object/B101302568/manifest.json,JACQ,OLEACEAE,Fraxinus excelsior L.,"Herbarium Josephine Goutrié; PRN2024-006; Herbarbeleg aus der Lehrveranstaltung Exkursionen zur Vegetationsökologie TU Berlin, Institut für Ökologie, Dr. Birgit Seitz","Goutrié,Josephine",s.n.,2017-09-21,,Germany,"Charlottenburg, an der Ruhwaldkolonie, ca. 100 m östlich des Rohrdamms, am Spreeufer",,,,,,,Fraxinus excelsior,Fraxinus,J. Goutrié,B 10 1302568,https://herbarium.bgbm.org/object/B101302568
B101304697,https://iiif.jacq.org/b/?manifest=https://herbarium.bgbm.org/object/B101304697/manifest.json,JACQ,FABACEAE,Lotus corniculatus L.,PRN2024-003; Pictures of the same individual or population as the preserved specimen(s). Photographer: Eckhard Willing,"Willing,E. & Willing,R.",37441 D,2023-06-07,,Germany,N Hassel,,,https://www.openstreetmap.org/?mlat=52.6439&mlon=11.9242#map=15/52.6439/11.9242,52.643890380859375,11.924169540405272,,Lotus corniculatus,Lotus,E. Willing,B 10 1304697,https://herbarium.bgbm.org/object/B101304697
B101309285,https://iiif.jacq.org/b/?manifest=https://herbarium.bgbm.org/object/B101309285/manifest.json,JACQ,POACEAE,Molinia caerulea (L.) Moench,"PRN2024-006; Herbarbeleg aus der Lehrveranstaltung Exkursionen zur Vegetationsökologie TU Berlin, Institut für Ökologie, Dr. Birgit Seitz; Herbarium Martin Voigt","Voigt,Martin",s.n.,2015-06-06,,Germany,"Köpenick, NSG und FFH-Gebiet ""Teufelsseemoor Köpenick""",,,,,,,Molinia caerulea,Molinia,M. Voigt,B 10 1309285,https://herbarium.bgbm.org/object/B101309285
B101023781,https://iiif.jacq.org/b/?manifest=https://herbarium.bgbm.org/object/B101023781/manifest.json,BGBM,SALICACEAE,Salix starkeana Willd. subsp. starkeana,"GBOL, Silikaprobe genommen; weiblich (ca 50 cm hoch),  Gruppe von ca. 3-4 m Durchmesser","Schepers,G.",20180220,2018-05-14,,Germany,"Germany: Baden-Württemberg. Rötenbach, TK 8115/22. 14.05.2018, Leg.: G. Schepers 20180220. ex herb. / ded. : herb. Georg Schepers.",,,https://www.openstreetmap.org/?mlat=47.8814&mlon=8.29861#map=15/47.8814/8.29861,47.88138961791992,8.298609733581543,"Germany: Baden-Württemberg. Rötenbach, TK 8115/22.",Salix starkeana subsp. starkeana,Salix,G. Schepers,B 10 1023781,https://herbarium.bgbm.org/object/B101023781
B180014981,,BGBM,COMPOSITAE,Carduus crispus L.,,"Royl,E.",,1997,,Germany,"Germany: Brandenburg, Barnim (Kreis), Wandlitz. 1997, Leg.: E. Royl s.n.",,,,,,"Germany: Brandenburg, Barnim (Kreis), Wandlitz.",Carduus crispus,Carduus,,B 18 0014981,https://herbarium.bgbm.org/object/B180014981
JACQID1075472,,JACQ,LAMIACEAE,Lamiastrum galeobdolon (L.) Ehrend. & Polatschek,MTB: 8433/4,"Willing,R. & Willing,E.",15823 D,2001-08-07,,Germany,"Bayern, Wallgau",,,https://www.openstreetmap.org/?mlat=47.5297&mlon=11.3033#map=15/47.5297/11.3033,47.52972030639648,11.303330421447754,,Lamiastrum galeobdolon,Lamiastrum,E.Willing,JACQ-ID 1075472,https://herbarium.bgbm.org/object/JACQID1075472
B101318465,https://image.bgbm.org/images/internal/HerbarThumbs/B101318465_1700,VVis,,Opuntia ficus indica (l.) mill.,"Museum botanicum berolinense cactaceae burser herbar (ups) image 2025 mus. bot. berol. mus. bot. berol. d50 illuminant, 2 degree observer density golden thread colors by munsell color services lab don williams",Bauh,26,,,Germany,"Berlin, , Botanischer garten & botanisches museum berlin",,,,,,"Ficus indica folio spinoso, fructu majore bauh. indianische feigen",Opuntia ficus indica,Opuntia,,B 10 1318465,https://herbarium.bgbm.org/object/B101318465
JACQID1059798,,JACQ,ASTERACEAE,Achillea millefolium L.,MTB: 8330/2,"Willing,R. & Willing,E.",13329 D,2001-07-24,,Germany,"Bayern, N Prem",,,https://www.openstreetmap.org/?mlat=47.6906&mlon=10.8036#map=15/47.6906/10.8036,47.69055938720703,10.80360984802246,,Achillea millefolium,Achillea,E.Willing,JACQ-ID 1059798,https://herbarium.bgbm.org/object/JACQID1059798
B100582888,,JACQ,POACEAE,Poa bulbosa L.,MTB: 4437,"Willing,R. & Willing,E.",28448 D,2014-04-26,,Germany,"Sachsen-Anhalt, Mücheln",,,https://www.openstreetmap.org/?mlat=51.5808&mlon=11.8294#map=15/51.5808/11.8294,51.58082962036133,11.829440116882324,,Poa bulbosa,Poa,E.Willing,B 10 0582888,https://herbarium.bgbm.org/object/B100582888
B101070496,https://iiif.jacq.org/b/?manifest=https://herbarium.bgbm.org/object/B101070496/manifest.json,HERB,ACERACEAE,Acer dasycarpum Ehrh.,"Label data transcribed during a <a href=""https://www.herbonauten.de"" target=""_blank"">Herbonauten mission</a>",H. Riese u. J. Golenz,,1873-03-01,1873-08-31,Germany,"Germany: Brandenburg. Spremberg: Slamen, angepflzt. 1873-03-01 - 1873-08-31, Leg.: H. Riese u. J. Golenz.",,,https://www.openstreetmap.org/?mlat=51.5672&mlon=14.3882#map=15/51.5672/14.3882,51.56724548339844,14.388166427612305,,Acer dasycarpum Ehrh.,Acer,,B 10 1070496,http://herbarium.bgbm.org/object/B101070496
JACQID1083936,,JACQ,ASTERACEAE,Senecio fuchsii C. C. Gmel.,MTB: 8434/2,"Willing,R. & Willing,E.",15962 D,2001-08-07,,Germany,"Bayern, W Vorderriß",,,https://www.openstreetmap.org/?mlat=47.5572&mlon=11.4542#map=15/47.5572/11.4542,47.557220458984375,11.45417022705078,,Senecio fuchsii,Senecio,E.Willing,JACQ-ID 1083936,https://herbarium.bgbm.org/object/JACQID1083936
B100705148,https://iiif.jacq.org/b/?manifest=https://herbarium.bgbm.org/object/B100705148/manifest.json,BGBM,UMBELLIFERAE,Bupleurum falcatum L. subsp. falcatum,"GBOL4198, Silikaprobe genommen, beprobtes Exemplar mit * markiert","Hand,R.",7621,2016-07-05,,Germany,"Germany: Thüringen. Arnstadt, Eichfelder Weg, Aufstieg auf Eichfeld-Plateau. Magerrasenreste in lichtem Wald. Alt.: 365m. 05.07.2016, Leg.: R. Hand 7621.",,,https://www.openstreetmap.org/?mlat=50.8339&mlon=10.9217#map=15/50.8339/10.9217,50.83388900756836,10.921669960021973,"Germany: Thüringen. Arnstadt, Eichfelder Weg, Aufstieg auf Eichfeld-Plateau. Magerrasenreste in lichtem Wald.",Bupleurum falcatum subsp. falcatum,Bupleurum,R. Hand,B 10 0705148,https://herbarium.bgbm.org/object/B100705148
B100561986,,JACQ,POACEAE,Triticum turgidum subsp. durum (Desf.) Husn.,sheet 2 of B 10 0531862,Hohenacker,101,,,Germany,.,,,,,,Schwärzlicher Bartweizen,Triticum turgidum subsp. durum,Triticum,M. W. van Slageren 14.3.2016,B 10 0561986,https://herbarium.bgbm.org/object/B100561986
JACQID1082724,,JACQ,CARYOPHYLLACEAE,Scleranthus annuus L.,MTB: 4239/1/4/2,"Willing,R. & Willing,E.",26705 D,2010-09-30,,Germany,"Sachsen-Anhalt, S Haideburg",,,https://www.openstreetmap.org/?mlat=51.7725&mlon=12.2492#map=15/51.7725/12.2492,51.772499084472656,12.249170303344728,,Scleranthus annuus,Scleranthus,E.Willing,JACQ-ID 1082724,https://herbarium.bgbm.org/object/JACQID1082724
B100762208,https://iiif.jacq.org/b/?manifest=https://herbarium.bgbm.org/object/B100762208/manifest.json,BGBM,LABIATAE,Origanum vulgare L. subsp. vulgare,"GBOL, Silikaprobe genommen; Aufsammlung von einem Individuum","Hand,R.",8542,2017-07-04,,Germany,"Germany: Rheinland-Pfalz. Waldrach, südlicher Teil Biedelt, am S-exponierten Hang. an Wegrand. Alt.: 353m. 04.07.2017, Leg.: R. Hand 8542.",,,https://www.openstreetmap.org/?mlat=49.7458&mlon=6.7625#map=15/49.7458/6.7625,49.74583053588867,6.762499809265137,"Germany: Rheinland-Pfalz. Waldrach, südlicher Teil Biedelt, am S-exponierten Hang. an Wegrand.",Origanum vulgare subsp. vulgare,Origanum,R. Hand,B 10 0762208,https://herbarium.bgbm.org/object/B100762208
B100733980,https://iiif.jacq.org/b/?manifest=https://herbarium.bgbm.org/object/B100733980/manifest.json,JACQ,CYPERACEAE,Carex remota L.,,"Willing,E. & Willing,R.",30477 D,2016-08-07,,Germany,"Harz, GK 4408589, 5732533, TK 4230, Photo",,,https://www.openstreetmap.org/?mlat=51.7194&mlon=10.6756#map=15/51.7194/10.6756,51.71944046020508,10.675559997558594,,Carex remota,Carex,E. Willing,B 10 0733980,https://herbarium.bgbm.org/object/B100733980
BGT0010895,,BGBM,JUNCACEAE,Luzula alpina Hoppe,,"Hand,R. & Raab-Straube,E. von",RH 6793,2014-07-23,,Germany,"Germany: Bayern. Oberstdorf, Gundsattel NNE Kanzelwand, am Hauptwanderweg, nahe Sesselliftstation. mehr oder weniger feuchte Nardeten. Alt.: 1759 m. 23.07.2014, Leg.: R. Hand & E. von Raab-Straube RH 6793.",,,https://www.openstreetmap.org/?mlat=47.34&mlon=10.2097#map=15/47.34/10.2097,47.34000015258789,10.20971965789795,"Germany: Bayern. Oberstdorf, Gundsattel NNE Kanzelwand, am Hauptwanderweg, nahe Sesselliftstation. mehr oder weniger feuchte Nardeten.",Luzula alpina,Luzula,R. Hand,B GT 0010895,https://herbarium.bgbm.org/object/BGT0010895
B100553181,https://iiif.jacq.org/b/?manifest=https://herbarium.bgbm.org/object/B100553181/manifest.json,BGBM,CYPERACEAE,Carex sylvatica Huds. subsp. sylvatica,"GBOL1246, Silikaprobe genommen","Hand,R.",6556,2014-06-11,,Germany,"Germany: Bayern. Schondorf am Ammersee, entlang Waldweg im Weingarten NW Strandbad, nahe Tennisplatz. Waldweg. Alt.: 545 m. 11.06.2014, Leg.: R. Hand 6556.",,,https://www.openstreetmap.org/?mlat=48.0564&mlon=11.1#map=15/48.0564/11.1,48.05638885498047,11.100000381469728,"Germany: Bayern. Schondorf am Ammersee, entlang Waldweg im Weingarten NW Strandbad, nahe Tennisplatz. Waldweg.",Carex sylvatica subsp. sylvatica,Carex,R. Hand,B 10 0553181,https://herbarium.bgbm.org/object/B100553181
B101014086,https://iiif.jacq.org/b/?manifest=https://herbarium.bgbm.org/object/B101014086/manifest.json,JACQ,POACEAE,Bromus inermis Leyss.,PRN2024-003,"Willing,E. & Willing,R.",37882 D,2023-07-03,,Germany,"SLK, NO Giersleben",,,https://www.openstreetmap.org/?mlat=51.7656&mlon=11.5728#map=15/51.7656/11.5728,51.76556015014648,11.572779655456545,,Bromus inermis,Bromus,E. Willing,B 10 1014086,https://herbarium.bgbm.org/object/B101014086
JACQID1088514,,JACQ,ASTERACEAE,Tripleurospermum inodorum (L.) Sch. Bip.,MTB: 3242/4,"Willing,R. & Willing,E.",7575 D,1999-07-17,,Germany,"Brandenburg, NO Königshorst",,,https://www.openstreetmap.org/?mlat=52.7292&mlon=12.7994#map=15/52.7292/12.7994,52.72917175292969,12.799440383911133,,Tripleurospermum inodorum,Tripleurospermum,E.Willing,JACQ-ID 1088514,https://herbarium.bgbm.org/object/JACQID1088514
JACQID1075804,,JACQ,JUNCACEAE,Juncus squarrosus L.,MTB: 3346/1,"Willing,R. & Willing,E.",4867 D,1998-06-20,,Germany,"Brandenburg, NW Summt",,,https://www.openstreetmap.org/?mlat=52.6919&mlon=13.35#map=15/52.6919/13.35,52.69194030761719,13.350000381469728,,Juncus squarrosus,Juncus,E.Willing,JACQ-ID 1075804,https://herbarium.bgbm.org/object/JACQID1075804
JACQID1065257,,JACQ,CARYOPHYLLACEAE,Cerastium semidecandrum L.,MTB: 4239/3/2/2,"Willing,R. & Willing,E.",26780 D,2011-05-29,,Germany,"Sachsen-Anhalt, NW Marke",,,https://www.openstreetmap.org/?mlat=51.7481&mlon=12.2419#map=15/51.7481/12.2419,51.7480583190918,12.241939544677734,,Cerastium semidecandrum,Cerastium,E.Willing,JACQ-ID 1065257,https://herbarium.bgbm.org/object/JACQID1065257
B101143698,https://iiif.jacq.org/b/?manifest=https://herbarium.bgbm.org/object/B101143698/manifest.json,JACQ,AGAVACEAE,Cordyline manners-suttoniae F. Muell.,Additional sheet: B 10 1143697; Blattmaterial für DNA Extraktion vom Lebendexemplar entnommen für T. Böhnert (BONN) 2023,"Cubr,M.",s.n.,2023-06-23,,Germany,"Cultivated in the Botanic Garden Berlin; provided by Botanic Garden Potsdam, Germany",,,,,,,Cordyline manners-suttoniae,Cordyline,Anonymous,B 10 1143698,https://herbarium.bgbm.org/object/B101143698
JACQID1067788,,JACQ,POACEAE,Dactylis glomerata L.,MTB: 4138/3/4/4,"Willing,R. & Willing,E.",23751 D,2008-05-15,,Germany,"Sachsen-Anhalt, SW Reppichau",,,https://www.openstreetmap.org/?mlat=51.8003&mlon=12.0642#map=15/51.8003/12.0642,51.8002815246582,12.064169883728027,,Dactylis glomerata,Dactylis,E.Willing,JACQ-ID 1067788,https://herbarium.bgbm.org/object/JACQID1067788
JACQID1087488,,JACQ,FABACEAE,Trifolium pratense L.,MTB: 3346/2,"Willing,R. & Willing,E.",18281 D,2002-06-22,,Germany,"Brandenburg, O Schönwalde",,,https://www.openstreetmap.org/?mlat=52.6789&mlon=13.4431#map=15/52.6789/13.4431,52.67889022827149,13.443059921264648,,Trifolium pratense,Trifolium,E.Willing,JACQ-ID 1087488,https://herbarium.bgbm.org/object/JACQID1087488
B101143897,https://iiif.jacq.org/b/?manifest=https://herbarium.bgbm.org/object/B101143897/manifest.json,JACQ,CRASSULACEAE,Kalanchoë miniata Hils. & Bojer ex Tul.,Gartenherbar,"Cubr,M.",52606,2024-02-08,,Germany,"Cultivated in Botanic Garden Berlin; provided by: Frankfurt, Palmengarten der Stadt Frankfurt; originally collected: Madagaskar, Analavelona, leg.: Anonymous s.n., s.d.",,,,,,"Blütenfarbe: zitr.gelb, rosa, gerundet, Filamente: hellgelb, Sep. hellgrün, Narbe: weiß, Griffel: zarthellgrün, Blätter mittel- dunkelgrün",Kalanchoë miniata,Kalanchoë,S. Bernhard (B) 2025-12-08,B 10 1143897,https://herbarium.bgbm.org/object/B101143897
B101302822,https://iiif.jacq.org/b/?manifest=https://herbarium.bgbm.org/object/B101302822/manifest.json,JACQ,ACERACEAE,Acer campestre L.,"Herbarium Sascha Prätzel; PRN2024-006; Herbarbeleg aus der Lehrveranstaltung Exkursionen zur Vegetationsökologie TU Berlin, Institut für Ökologie, Dr. Birgit Seitz; Baum des Jahres 2015, Korkleisten an jungen Zweigen, schnittverträglich","Prätzel,Sascha",s.n.,2014-10-08,,Germany,"Karow, nördlich Dorfstraße, Karower Feldgraben",,,,,,,Acer campestre,Acer,S. Prätzel,B 10 1302822,https://herbarium.bgbm.org/object/B101302822
JACQID1080223,,JACQ,POACEAE,Poaceae Barnhart,MTB: 3745/1,"Willing,R. & Willing,E.",516 D,1994-07-03,,Germany,"Brandenburg, 1,9 km WSW Siethen",,,https://www.openstreetmap.org/?mlat=52.275&mlon=31.1833#map=15/52.275/31.1833,52.275001525878906,31.183330535888672,,Poaceae,Poaceae,E.Willing,JACQ-ID 1080223,https://herbarium.bgbm.org/object/JACQID1080223
BGT0017925,,BGBM,CRUCIFERAE,Capsella bursa-pastoris (L.) Medik.,"GBOL, Silikaprobe genommen","Weicherding,F.-J.",FJW-2016-0003,2016-03-18,,Germany,"Germany: Saarland. St. Ingbert, Saarpfalz-Kreis, in der Kohlenstraße, TK 6708/222. südexponierter Scherrasenstreifen (MBST). Alt.: 223m. 18.03.2016, Leg.: F. -J. Weicherding FJW-2016-0003. ex herb. / ded. : herb. Franz-Josef Weicherding.",,,https://www.openstreetmap.org/?mlat=49.2792&mlon=7.11#map=15/49.2792/7.11,49.279170989990234,7.110000133514404,"Germany: Saarland. St. Ingbert, Saarpfalz-Kreis, in der Kohlenstraße, TK 6708/222. südexponierter Scherrasenstreifen (MBST).",Capsella bursa-pastoris,Capsella,F.-J. Weicherding,B GT 0017925,https://herbarium.bgbm.org/object/BGT0017925
BGT0000441,,BGBM,CRUCIFERAE,Arabidopsis thaliana (L.) Heynh.,,"Dürbye,T. & Kirchhoff,A.",DÜR 3543,2007-05-17,,Germany,"Germany: Berlin. Spandau, Staaken, Hahneberg, ehem. Grenzstreifen. Halbtrockenrasen, Silikat. Alt.: 42m. 17.5.2007, Leg.: T. Dürbye & A. Kirchhoff DÜR 3543.",,,https://www.openstreetmap.org/?mlat=52.5219&mlon=13.1419#map=15/52.5219/13.1419,52.521949768066406,13.141940116882324,"Germany: Berlin. Spandau, Staaken, Hahneberg, ehem. Grenzstreifen. Halbtrockenrasen, Silikat.",Arabidopsis thaliana,Arabidopsis,T. Raus,B GT 0000441,https://herbarium.bgbm.org/object/BGT0000441
B300326005,,HERB,Fissidentaceae,Fissidens adianthoides Hedw.,"Label data transcribed during a <a href=""https://www.herbonauten.de"" target=""_blank"">Herbonauten mission</a>",Frahm,12754,2010-10-04,2010-10-04,Germany,"Germany: Bayern. Kr. Berchtesgadener [Land], Moosenalm oberhalb Taubensee, Wiesen- und Waldmoore, Kalkfelswände; Höhe (m): 1300. 2010-10-04, Leg.: Frahm 12754.",,,https://www.openstreetmap.org/?mlat=47.6562&mlon=12.8726#map=15/47.6562/12.8726,47.6562385559082,12.872641563415527,,Fissidens adianthoides Hedw.,Fissidens,,B 30 0326005,http://herbarium.bgbm.org/object/B300326005
JACQID1066144,,JACQ,CONVOLVULACEAE,Convolvulus arvensis L.,MTB: 3741/3,"Willing,R. & Willing,E.",19886 D,2002-08-03,,Germany,"Brandenburg, O Klein Briesen",,,https://www.openstreetmap.org/?mlat=52.2403&mlon=12.5169#map=15/52.2403/12.5169,52.24028015136719,12.516940116882324,,Convolvulus arvensis,Convolvulus,E.Willing,JACQ-ID 1066144,https://herbarium.bgbm.org/object/JACQID1066144
B200226596,https://image.bgbm.org/images/internal/HerbarThumbs/B200226596_1700,VVis,,Lipscannum Rustomervaria Kouesroute,Herbarium E. KOCH Ex BHU Mus. Bot. Berol. B 20 0226596 Mus. bot. Berol. IMAGE 2025 BGBM Botanischer Garten & Botanisches Museum Berlin,"Koch,E.",,,,Germany,,,,,,,,Lipscannum Rustomervaria,Lipscannum,Bückow,B 20 0226596,https://herbarium.bgbm.org/object/B200226596
JACQID1063824,,JACQ,CYPERACEAE,Carex polyphylla Kar. & Kir.,MTB: 8332/3,"Willing,R. & Willing,E.",14639 D,2001-07-31,,Germany,"Bayern, SO Bad Kohlgrub, Ellmauberg",,,https://www.openstreetmap.org/?mlat=47.6456&mlon=11.0736#map=15/47.6456/11.0736,47.64556121826172,11.073610305786133,,Carex polyphylla,Carex,E.Willing,JACQ-ID 1063824,https://herbarium.bgbm.org/object/JACQID1063824
B101011790,https://iiif.jacq.org/b/?manifest=https://herbarium.bgbm.org/object/B101011790/manifest.json,HERB,Potamogetonaceae,Potamogeton polygonifolius,"Label data transcribed during a <a href=""https://www.herbonauten.de"" target=""_blank"">Herbonauten mission</a>",F. Wirtgen,,1899-07-03,1899-07-03,Germany,"Germany: Nordrhein-Westfalen. Mittelrhein R: Lind bei Wahn, am Weg-Übergang des Abzug-Grabens. 1899-07-03, Leg.: F. Wirtgen.",,,https://www.openstreetmap.org/?mlat=50.847&mlon=7.10816#map=15/50.847/7.10816,50.84703826904297,7.108163833618164,,Potamogeton polygonifolius,Potamogeton,G. Wiegleb,B 10 1011790,http://herbarium.bgbm.org/object/B101011790
B101006952,,JACQ,POACEAE,Avena hybrida Peterm.,Sheet 1 of 2 (B 10 1006951),"Voigt,H.",s.n.,1992-07-22,,Germany,"Brandenburg, Rhinow",,,,,,,Avena hybrida,Avena,H. W. Scholz 1999,B 10 1006952,https://herbarium.bgbm.org/object/B101006952
B100705459,https://iiif.jacq.org/b/?manifest=https://herbarium.bgbm.org/object/B100705459/manifest.json,BGBM,CHENOPODIACEAE,Atriplex tatarica L. subsp. tatarica,"GBOL, Silikaprobe genommen, Aufsammlung von einem Individuum","Hand,R.",8048,2016-09-07,,Germany,"Germany: Sachsen-Anhalt. Wimmelburg, Straßenrand E Bahnbrücke Richtung Blankenheim. Straßenrand und angrenzende Ruderalflächen. Alt.: 215m. 07.09.2016, Leg.: R. Hand 8048.",,,https://www.openstreetmap.org/?mlat=51.5156&mlon=11.5#map=15/51.5156/11.5,51.51556015014648,11.5,"Germany: Sachsen-Anhalt. Wimmelburg, Straßenrand E Bahnbrücke Richtung Blankenheim. Straßenrand und angrenzende Ruderalflächen.",Atriplex tatarica subsp. tatarica,Atriplex,R. Hand,B 10 0705459,https://herbarium.bgbm.org/object/B100705459
B100307442,https://image.bgbm.org/images/internal/HerbarThumbs/B100307442_1700,VVis,,Campanula trachelium L.,IMAGE 2026 Mus. Bot. Berol. Herbar des Instituts für Systematische Botanik und Pflanzengeographie der Freien Universität Berlin Fundort Nordhessen Standort ex BSB Bem. Dat. leg. det. Nr. BG BM Botanischer Garten & Botanisches Museum Berlin,Schönefeld,13460,1983-06-14,,Germany,"Hessen, , Ringgau (Schloßburg)",,,,,,,Campanula trachelium,Campanula,,B 10 0307442,https://herbarium.bgbm.org/object/B100307442
B101306833,https://iiif.jacq.org/b/?manifest=https://herbarium.bgbm.org/object/B101306833/manifest.json,JACQ,FABACEAE,Medicago varia Martyn,"Herbarium Annemarie Bäthge; PRN2024-006; Herbarbeleg aus der Lehrveranstaltung Exkursionen zur Vegetationsökologie TU Berlin, Institut für Ökologie, Dr. Birgit Seitz","Bäthge,Annemarie",s.n.,2018-05-27,,Germany,"Märkisch-Oderland, Odertal, ca. 500 m nördlich der Oderberge",,,,,,,Medicago varia,Medicago,A. Bäthge,B 10 1306833,https://herbarium.bgbm.org/object/B101306833
JACQID1064732,,JACQ,ASTERACEAE,Centaurea cyanus L.,MTB: 3042/3,"Willing,R. & Willing,E.",18741 D,2002-06-29,,Germany,"Brandenburg, N Dabergotz",,,https://www.openstreetmap.org/?mlat=52.9067&mlon=12.7306#map=15/52.9067/12.7306,52.90666961669922,12.730560302734377,,Centaurea cyanus,Centaurea,E.Willing,JACQ-ID 1064732,https://herbarium.bgbm.org/object/JACQID1064732
BGT0008007,,BGBM,COMPOSITAE,Arnica montana L. subsp. montana,"GBOL, Blattmaterial entnommen","Kalheber,H.",78-460,1978-07-02,,Germany,"Germany: Hessen, Dillkreis, Hoher Westerwald, Gusternhain, Wiese E der Straße zur B 255, TK 5315/1. Alt.: 515m. 02.07.1978, Leg.: H. Kalheber 78-460. ex herb. / ded. : ex Herbarium Heinz Kalheber.",,,https://www.openstreetmap.org/?mlat=50.6556&mlon=8.18333#map=15/50.6556/8.18333,50.65555953979492,8.183329582214355,"Germany: Hessen, Dillkreis, Hoher Westerwald, Gusternhain, Wiese E der Straße zur B 255, TK 5315/1.",Arnica montana subsp. montana,Arnica,R. Hand,B GT 0008007,https://herbarium.bgbm.org/object/BGT0008007
BGT0013205,,BGBM,COMPOSITAE,Arnica montana L. subsp. montana,,"Sossai,E.",ES15,2013-08-05,,Germany,"Germany: Baden-Wüttenburg. Feldberg, Todtnauer Hütte ,Schwarzwald. Alt.: 1343 m. 05.08.2013, Leg.: E. Sossai ES15.",,,,,,"Germany: Baden-Wüttenburg. Feldberg, Todtnauer Hütte ,Schwarzwald.",Arnica montana subsp. montana,Arnica,E. Sossai,B GT 0013205,https://herbarium.bgbm.org/object/BGT0013205
B101011758,https://iiif.jacq.org/b/?manifest=https://herbarium.bgbm.org/object/B101011758/manifest.json,HERB,Potamogetonaceae,Potamogeton polygonifolius,"Label data transcribed during a <a href=""https://www.herbonauten.de"" target=""_blank"">Herbonauten mission</a>",Delitsch,,,,Germany,Germany: Sachsen. In Quellen und Gräben der Berg??  . .  bei Klaffenbach (bei Chemnitz). Leg.: Delitsch.,,,https://www.openstreetmap.org/?mlat=50.7604&mlon=12.9095#map=15/50.7604/12.9095,50.76041793823242,12.909540176391602,,Potamogeton polygonifolius,Potamogeton,,B 10 1011758,http://herbarium.bgbm.org/object/B101011758
JACQID1070144,,JACQ,ASTERACEAE,Eupatorium cannabinum L.,MTB: 8330/2,"Willing,R. & Willing,E.",13364 D,2001-07-24,,Germany,"Bayern, N Prem",,,https://www.openstreetmap.org/?mlat=47.6828&mlon=10.8022#map=15/47.6828/10.8022,47.68278121948242,10.802220344543455,,Eupatorium cannabinum,Eupatorium,E.Willing,JACQ-ID 1070144,https://herbarium.bgbm.org/object/JACQID1070144
B700003708,,JACQ,PEZIZACEAE,Peziza atrospora Fuckel,MTB 4828,"Benkert,D.",s.n.,1990-10-14,,Germany,"Wartburgkreis, nordöstlich Nazza, in einem Grund am Teufelskopf",,,https://www.openstreetmap.org/?mlat=51.1&mlon=10.3333#map=15/51.1/10.3333,51.099998474121094,10.333330154418944,,Peziza atrospora,Peziza,D. Benkert,B 70 0003708,https://herbarium.bgbm.org/object/B700003708
JACQID1088008,,JACQ,SCROPHULARIACEAE,Veronica hederifolia L.,MTB: 3645/1,"Willing,R. & Willing,E.",5288 D,1999-05-01,,Germany,"Brandenburg, SW Stahnsdorf",,,https://www.openstreetmap.org/?mlat=52.3836&mlon=13.2131#map=15/52.3836/13.2131,52.38360977172851,13.21306037902832,,Veronica hederifolia,Veronica,E.Willing,JACQ-ID 1088008,https://herbarium.bgbm.org/object/JACQID1088008
JACQID1088904,,JACQ,VIOLACEAE,Viola canina L.,MTB: 3146/3,"Willing,R. & Willing,E.",11587 D,1999-05-22,,Germany,"Brandenburg, N Zehlendorf",,,https://www.openstreetmap.org/?mlat=52.8128&mlon=13.4069#map=15/52.8128/13.4069,52.81277847290039,13.406940460205078,,Viola canina,Viola,E.Willing,JACQ-ID 1088904,https://herbarium.bgbm.org/object/JACQID1088904
B100649412,https://iiif.jacq.org/b/?manifest=https://herbarium.bgbm.org/object/B100649412/manifest.json,HERB,Chenopodiaceae,Salsola kali,"Label data transcribed during a <a href=""https://www.herbonauten.de"" target=""_blank"">Herbonauten mission</a>",H. Beger,,1907-07-20,1907-07-20,Germany,"Germany: Mecklenburg-Vorpommern. Rügen: Strand a. d. Wissower Klinken. 1907-07-20, Leg.: H. Beger.",,,https://www.openstreetmap.org/?mlat=54.5325&mlon=13.6781#map=15/54.5325/13.6781,54.532501220703125,13.678099632263184,,Salsola kali,Salsola,Sabrina Rilke,B 10 0649412,http://herbarium.bgbm.org/object/B100649412
JACQID1063960,,JACQ,CYPERACEAE,Carex acutiformis Ehrh.,MTB: 4138/1/1/3,"Willing,R. & Willing,E.",25858 D,2009-07-07,,Germany,"Sachsen-Anhalt, N Obselau",,,https://www.openstreetmap.org/?mlat=51.8786&mlon=12.0125#map=15/51.8786/12.0125,51.87860870361328,12.012499809265137,,Carex acutiformis,Carex,E.Willing,JACQ-ID 1063960,https://herbarium.bgbm.org/object/JACQID1063960
